{
  "schema_version": "2026-07-03",
  "skill_id": "qveris-quant-factor-screen",
  "generated_at": "2026-07-03T08:18:27.398Z",
  "mode": "live",
  "scope": {
    "universe": [
      "AAPL",
      "MSFT"
    ],
    "market": "US",
    "window_days": 90,
    "factor_set": [
      "valuation",
      "quality",
      "liquidity",
      "momentum",
      "news_risk"
    ]
  },
  "findings": [
    "Screen universe contains 2 tickers: AAPL, MSFT.",
    "Factor coverage attempted: valuation_ratios, quality_overview, liquidity_float, price_momentum, news_risk.",
    "Generated a 2-row ranking table with 2 scored ticker(s).",
    "Ranking exposes raw fields, normalized scores, missing-field flags, factor weights, and tie-break rules."
  ],
  "evidence": [
    {
      "role": "valuation_ratios",
      "target": "AAPL",
      "tool_id": "financialmodelingprep.stable.ratios.retrieve.v1.bd1624ef",
      "ok": true,
      "cost": 24.2,
      "execution_id": "03f39f8a-9fd5-48a4-9df5-cf07d9f537a9",
      "record_count": 1,
      "error": null
    },
    {
      "role": "valuation_ratios",
      "target": "MSFT",
      "tool_id": "financialmodelingprep.stable.ratios.retrieve.v1.bd1624ef",
      "ok": true,
      "cost": 24.2,
      "execution_id": "4ba5ae6d-8871-41fa-bacf-fc9e371289a8",
      "record_count": 1,
      "error": null
    },
    {
      "role": "quality_overview",
      "target": "AAPL",
      "tool_id": "alphavantage.fundamentals.income_statement.retrieve.v1.7aca3c4a",
      "ok": true,
      "cost": 2,
      "execution_id": "ca2ed60d-a513-4ad1-a819-d2d0fc21ee1c",
      "record_count": 1,
      "error": null
    },
    {
      "role": "quality_overview",
      "target": "MSFT",
      "tool_id": "alphavantage.fundamentals.income_statement.retrieve.v1.7aca3c4a",
      "ok": true,
      "cost": 2,
      "execution_id": "73476508-c584-4982-80d9-e362f30e3b92",
      "record_count": 1,
      "error": null
    },
    {
      "role": "liquidity_float",
      "target": "AAPL",
      "tool_id": "financialmodelingprep.stable.sharesfloat.retrieve.v1.9fdd1e4f",
      "ok": true,
      "cost": 24.2,
      "execution_id": "b0aa6b19-da8b-4d43-be5e-48e8cff23312",
      "record_count": 1,
      "error": null
    },
    {
      "role": "liquidity_float",
      "target": "MSFT",
      "tool_id": "financialmodelingprep.stable.sharesfloat.retrieve.v1.9fdd1e4f",
      "ok": true,
      "cost": 24.2,
      "execution_id": "955a545a-44aa-4cdf-abd7-ed37dd5fdd2b",
      "record_count": 1,
      "error": null
    },
    {
      "role": "price_momentum",
      "target": "AAPL",
      "tool_id": "financialmodelingprep.stable.historicalpriceeod.full.retrieve.v1.b0c32b22",
      "ok": true,
      "cost": 24.2,
      "execution_id": "6c997a3c-d64c-4ccf-b34b-b70c3569efce",
      "record_count": 62,
      "error": null
    },
    {
      "role": "price_momentum",
      "target": "MSFT",
      "tool_id": "financialmodelingprep.stable.historicalpriceeod.full.retrieve.v1.b0c32b22",
      "ok": true,
      "cost": 24.2,
      "execution_id": "1ef61662-601b-4a93-9d11-b09e39420d67",
      "record_count": 62,
      "error": null
    },
    {
      "role": "news_risk",
      "target": "AAPL",
      "tool_id": "alphavantage.news_sentiment.query.v1.467a92c0",
      "ok": true,
      "cost": 2,
      "execution_id": "f8a6c4f0-8205-4443-9260-8bf8301dc67a",
      "record_count": 8,
      "error": null
    },
    {
      "role": "news_risk",
      "target": "MSFT",
      "tool_id": "alphavantage.news_sentiment.query.v1.467a92c0",
      "ok": true,
      "cost": 2,
      "execution_id": "4878f166-f434-4480-ab3e-408d522b3c99",
      "record_count": 8,
      "error": null
    }
  ],
  "risks": [
    "Do not rank missing fundamentals as neutral without flagging the gap.",
    "Provider coverage can vary by market and ticker.",
    "This is a research screen, not a buy/sell recommendation."
  ],
  "usage": {
    "paid_calls": 10,
    "estimated_credits": 153.2
  },
  "result": {
    "universe": [
      "AAPL",
      "MSFT"
    ],
    "factor_set": [
      "valuation",
      "quality",
      "liquidity",
      "momentum",
      "news_risk"
    ],
    "coverage_roles": [
      "valuation_ratios",
      "quality_overview",
      "liquidity_float",
      "price_momentum",
      "news_risk"
    ],
    "scoring_version": "deterministic-preview-2026-07-03",
    "ranking_ready": true,
    "coverage_level": "complete",
    "ranking_table": [
      {
        "rank": 1,
        "symbol": "AAPL",
        "score": 0.84,
        "data_status": "complete",
        "raw_fields": {
          "pe": 34.1068090787717,
          "roe": 1.415,
          "profit_margin": 0.272,
          "float_shares": 14662534368,
          "volume": null,
          "quote_change_pct": null,
          "technical": null,
          "price_momentum_return_pct": 19.2266,
          "news_sentiment": {
            "positive": 44,
            "negative": 6
          }
        },
        "normalized_scores": {
          "valuation": 0.43155318202047177,
          "quality": 1,
          "liquidity": 1,
          "momentum": 1,
          "news_risk": 0.88
        },
        "missing_factors": []
      },
      {
        "rank": 2,
        "symbol": "MSFT",
        "score": 0.594,
        "data_status": "complete",
        "raw_fields": {
          "pe": 36.307299270072996,
          "roe": 0.34,
          "profit_margin": 0.393,
          "float_shares": 7417514905,
          "volume": null,
          "quote_change_pct": null,
          "technical": null,
          "price_momentum_return_pct": 4.7227,
          "news_sentiment": {
            "positive": 68,
            "negative": 10
          }
        },
        "normalized_scores": {
          "valuation": 0.3948783454987834,
          "quality": 0.34,
          "liquidity": 0.9870258427675465,
          "momentum": 0.657,
          "news_risk": 0.872
        },
        "missing_factors": []
      }
    ],
    "factor_weights": {
      "valuation": 0.25,
      "quality": 0.25,
      "liquidity": 0.15,
      "momentum": 0.2,
      "news_risk": 0.15
    },
    "tie_break_rules": [
      "Prefer higher total score.",
      "If scores tie, prefer more non-missing factors.",
      "If still tied, prefer higher liquidity score.",
      "If still tied, prefer lower news-risk burden.",
      "Do not promote a ticker with missing fundamentals above a fully covered ticker on model judgement alone."
    ],
    "missing_outputs": [],
    "missing_data": []
  }
}